{
  "$schema": "https://json-schema.org/draft/2020-12/schema",
  "$id": "https://codex.local/tavo/schemas/evidence-registry.schema.json",
  "title": "Tavo Evidence Registry",
  "type": "object",
  "required": ["schemaVersion", "updatedAt", "sourcePolicy", "claims"],
  "properties": {
    "schemaVersion": {
      "const": "1.0.0"
    },
    "updatedAt": {
      "type": "string",
      "pattern": "^[0-9]{4}-[0-9]{2}-[0-9]{2}$"
    },
    "sourcePolicy": {
      "type": "string",
      "minLength": 1
    },
    "claims": {
      "type": "array",
      "minItems": 1,
      "items": {
        "$ref": "#/$defs/claim"
      }
    }
  },
  "$defs": {
    "claim": {
      "type": "object",
      "required": [
        "claim_id",
        "topic",
        "verdict",
        "evidence_tier",
        "official_source",
        "mcp_source",
        "live_artifact",
        "app_version",
        "last_verified",
        "retention",
        "staleness_policy",
        "notes"
      ],
      "properties": {
        "claim_id": {
          "type": "string",
          "pattern": "^[a-z0-9]+(?:-[a-z0-9]+)*$"
        },
        "topic": {
          "type": "string",
          "minLength": 1
        },
        "verdict": {
          "enum": ["verified", "mixed", "official-only", "runtime-only", "probable", "workaround", "blocked", "deprecated"]
        },
        "evidence_tier": {
          "enum": [
            "official-current",
            "mcp-runtime",
            "schema-seen",
            "dry-run-pass",
            "roundtrip-pass",
            "semantic-pass",
            "semantic-pass-observation",
            "ui-pass",
            "live-verified",
            "live-verified-regression",
            "semantic-mixed",
            "historical-derived",
            "deprecated"
          ]
        },
        "official_source": {
          "type": "string"
        },
        "mcp_source": {
          "type": "string"
        },
        "live_artifact": {
          "type": "string"
        },
        "app_version": {
          "type": "string"
        },
        "last_verified": {
          "type": "string"
        },
        "retention": {
          "type": "string",
          "minLength": 1
        },
        "staleness_policy": {
          "type": "string",
          "minLength": 1
        },
        "notes": {
          "type": "string",
          "minLength": 1
        }
      },
      "additionalProperties": false
    }
  },
  "additionalProperties": false
}
