{
  "schemaVersion": "1.0.0",
  "updatedAt": "2026-07-17",
  "sourcePolicy": "Declared surface: official-current > mcp-runtime > historical. Observed reliability: current live positive and negative evidence governs; conflicts require mixed or blocked.",
  "claims": [
    {
      "claim_id": "tavo-092-adb-mcp-gate-20260716",
      "topic": "phone-validation",
      "verdict": "verified",
      "evidence_tier": "live-verified",
      "official_source": "https://docs.tavoai.dev/cn/guides/mcp-server/",
      "mcp_source": "assets/schemas/mcp-surface-index-0.92.0-20260716.json",
      "live_artifact": "assets/evidence/0.92.0/20260716-gate.json",
      "app_version": "0.92.0",
      "last_verified": "2026-07-16",
      "retention": "retained-redacted-gate-artifact-and-versioned-surface",
      "staleness_policy": "Rerun after app update, device change, endpoint/token reset, MCP protocol change, or before any stateful phone matrix.",
      "notes": "ADB device/app/PID checks, five MCP top-level reads, all 17 selected runtime documents, and a read-only tavo_status tools/call passed. The gate does not prove new 0.92 hook, TTS, ASR, theme, backup, or WebView semantics."
    },
    {
      "claim_id": "tavo-092-plugin-hook-surface-20260716",
      "topic": "plugins",
      "verdict": "runtime-only",
      "evidence_tier": "mcp-runtime",
      "official_source": "assets/official-docs/text-20260716/cn_guides_plugin-development.txt",
      "mcp_source": "assets/schemas/mcp-surface-0.92.0-20260716.json",
      "live_artifact": "",
      "app_version": "0.92.0",
      "last_verified": "2026-07-16",
      "retention": "retained-official-and-redacted-runtime-doc-snapshots",
      "staleness_policy": "Promote individual entry/config/chat/message/input/generation/TTS claims only after matching 0.92 phone assertions pass.",
      "notes": "Official and runtime docs declare entry precedence, hook-only entry support, config.get/all, chat/message notifications, input interception, generation lifecycle hooks, input.send results, and plugin TTS. These are declared surfaces, not live reliability claims."
    },
    {
      "claim_id": "tavo-092-plugin-entry-config-live-20260717",
      "topic": "plugins",
      "verdict": "verified",
      "evidence_tier": "live-verified",
      "official_source": "assets/official-docs/text-20260716/cn_guides_plugin-development.txt",
      "mcp_source": "assets/schemas/mcp-surface-0.92.0-20260716.json",
      "live_artifact": "assets/evidence/0.92.0/20260717-live-matrix.json",
      "app_version": "0.92.0",
      "last_verified": "2026-07-17",
      "retention": "retained-redacted-atomic-summary-and-disabled-fixtures",
      "staleness_policy": "Rerun after plugin loader, manifest, config, WebView runtime, or app-version changes.",
      "notes": "F01-F04 proved entry-only execution without UI contributions, legacy execution, entry precedence over legacy, effective config defaults/overrides, and all() copy isolation."
    },
    {
      "claim_id": "tavo-092-plugin-notifications-mixed-20260717",
      "topic": "plugins",
      "verdict": "mixed",
      "evidence_tier": "live-verified-regression",
      "official_source": "assets/official-docs/text-20260716/cn_guides_plugin-development.txt",
      "mcp_source": "assets/schemas/mcp-surface-0.92.0-20260716.json",
      "live_artifact": "assets/evidence/0.92.0/20260717-live-matrix.json",
      "app_version": "0.92.0",
      "last_verified": "2026-07-17",
      "retention": "retained-redacted-atomic-summary-and-source-artifacts",
      "staleness_policy": "Retest chat alias delivery after plugin runtime, chat lifecycle, WebView, or app changes.",
      "notes": "Specific message ordering, persistent-add boundary, and handler isolation passed; a controlled chat update did not reach the chat:changed compatibility handler as chat:updated."
    },
    {
      "claim_id": "tavo-092-input-hooks-send-live-20260717",
      "topic": "plugins",
      "verdict": "verified",
      "evidence_tier": "live-verified",
      "official_source": "assets/official-docs/text-20260716/cn_guides_plugin-development.txt",
      "mcp_source": "assets/schemas/mcp-surface-0.92.0-20260716.json",
      "live_artifact": "assets/evidence/0.92.0/20260717-live-matrix.json",
      "app_version": "0.92.0",
      "last_verified": "2026-07-17",
      "retention": "retained-redacted-atomic-summary-and-source-artifacts",
      "staleness_policy": "Rerun after input pipeline, plugin runtime, WebView, MCP send, or app changes.",
      "notes": "F06/F10 proved UI, TavoJS, and MCP rewrite/cancel/fail-open plus structured acceptance-time send results. Attachment preservation was not exposed and busy was not observed."
    },
    {
      "claim_id": "tavo-092-generation-hooks-mixed-20260717",
      "topic": "plugins",
      "verdict": "mixed",
      "evidence_tier": "live-verified-regression",
      "official_source": "assets/official-docs/text-20260716/cn_guides_plugin-development.txt",
      "mcp_source": "assets/schemas/mcp-surface-0.92.0-20260716.json",
      "live_artifact": "assets/evidence/0.92.0/20260717-live-matrix.json",
      "app_version": "0.92.0",
      "last_verified": "2026-07-17",
      "retention": "retained-redacted-atomic-summary-and-provider-capture-metadata",
      "staleness_policy": "Retest every generation source and auxiliary exclusion after generation pipeline or app changes.",
      "notes": "Prepare, success, fail-open, sanitized errors, cancellation persistence, and terminal exclusivity passed. The controlled othersContinuation path did not emit a Hook or message; auxiliary exclusions remained blocked."
    },
    {
      "claim_id": "tavo-092-plugin-package-update-backup-20260717",
      "topic": "plugins",
      "verdict": "verified",
      "evidence_tier": "roundtrip-pass",
      "official_source": "assets/official-docs/text-20260716/cn_guides_plugin-development.txt",
      "mcp_source": "assets/schemas/mcp-surface-0.92.0-20260716.json",
      "live_artifact": "assets/evidence/0.92.0/20260717-live-matrix.json",
      "app_version": "0.92.0",
      "last_verified": "2026-07-17",
      "retention": "retained-redacted-summary-private-backup-uninspected-and-disabled-fixtures",
      "staleness_policy": "Rerun after package importer, update, backup schema, restore flow, or app-version changes.",
      "notes": "Root, single-wrapper, and development-zip imports passed; same-id update preserved config/enabled/runtime; native Backup B restored id/version/config/enabled/runtime. Only absolute/traversal negatives were live-rejected; remaining negative fixtures are offline-only."
    },
    {
      "claim_id": "tavo-092-tts-integration-mixed-20260717",
      "topic": "media",
      "verdict": "mixed",
      "evidence_tier": "live-verified",
      "official_source": "assets/official-docs/text-20260716/cn_guides_javascript-api.txt",
      "mcp_source": "assets/schemas/mcp-surface-0.92.0-20260716.json",
      "live_artifact": "assets/evidence/0.92.0/20260717-live-matrix.json",
      "app_version": "0.92.0",
      "last_verified": "2026-07-17",
      "retention": "retained-redacted-request-metadata-provider-removed-binding-restored",
      "staleness_policy": "Retest after TTS provider, binding, queue, audio backend, plugin runtime, or app changes.",
      "notes": "Configured character and queued fake-gateway requests were accepted; persona was not retested with a working binding. Identity, quality, and audible stop semantics remain manual."
    },
    {
      "claim_id": "tavo-092-asr-native-integration-mixed-20260717",
      "topic": "media",
      "verdict": "mixed",
      "evidence_tier": "live-verified",
      "official_source": "",
      "mcp_source": "assets/schemas/mcp-surface-index-0.92.0-20260716.json",
      "live_artifact": "assets/evidence/0.92.0/20260717-live-matrix.json",
      "app_version": "0.92.0",
      "last_verified": "2026-07-17",
      "retention": "retained-redacted-request-metadata-provider-removed-input-cleared",
      "staleness_policy": "Retest after native ASR UI, permission, provider protocol, composer, or app changes.",
      "notes": "Docs/MCP do not expose ASR, but native UI and multipart fake-gateway transcription worked with release-to-send, cancel, fill, edit, clear, and bounded transport failure. Human recognition accuracy remains manual."
    },
    {
      "claim_id": "tavo-092-theme-voice-rules-ui-20260717",
      "topic": "settings",
      "verdict": "verified",
      "evidence_tier": "ui-pass",
      "official_source": "assets/official-docs/text-20260716/cn_guides_theme.txt",
      "mcp_source": "",
      "live_artifact": "assets/evidence/0.92.0/20260717-live-matrix.json",
      "app_version": "0.92.0",
      "last_verified": "2026-07-17",
      "retention": "retained-ui-evidence-temporary-settings-removed-originals-restored",
      "staleness_policy": "Rerun after theme editor, voice-rule UI, settings persistence, or app changes.",
      "notes": "Bold/italic, bubble sides, 30/70 percent visual-novel previews, and role/user voice-rule scope persisted in UI; original settings were restored. No audible filtering claim is made."
    },
    {
      "claim_id": "tavo-092-image-novelai-ui-bounded-20260717",
      "topic": "media",
      "verdict": "verified",
      "evidence_tier": "ui-pass",
      "official_source": "assets/official-docs/text-20260716/cn_guides_voice-connection_image-api-settings.txt",
      "mcp_source": "",
      "live_artifact": "assets/evidence/0.92.0/20260717-live-matrix.json",
      "app_version": "0.92.0",
      "last_verified": "2026-07-17",
      "retention": "retained-redacted-ui-and-request-metadata-providers-removed",
      "staleness_policy": "Rerun after image provider form, generation protocol, chat insertion, or app changes.",